{
  "version": "2.5.0",
  "revision": 1,
  "project": {
    "name": "Brownfield monolith modernization",
    "type": "brownfield",
    "criticality": "high",
    "profile": "high-assurance",
    "root": "D:\\project\\skills-hub\\Agentic_SDLC_OS_v2_5\\validation\\multi_project\\runs\\brownfield-modernization",
    "created_at": "2026-09-07T03:46:14Z",
    "updated_at": "2026-09-07T03:46:14Z"
  },
  "current_os": "engineering",
  "current_stage": "INTAKE",
  "status": "active",
  "os_states": {
    "pm": {
      "stage": "INTAKE",
      "status": "pending",
      "history": []
    },
    "design": {
      "stage": "INTAKE",
      "status": "pending",
      "history": []
    },
    "engineering": {
      "stage": "INTAKE",
      "status": "active",
      "history": [
        {
          "stage": "INTAKE",
          "at": "2026-09-07T03:46:14Z",
          "reason": "initialized"
        }
      ]
    },
    "qa": {
      "stage": "INTAKE",
      "status": "pending",
      "history": []
    },
    "release": {
      "stage": "INTAKE",
      "status": "pending",
      "history": []
    },
    "evolution": {
      "stage": "INTAKE",
      "status": "pending",
      "history": []
    }
  },
  "history": [
    {
      "event": "project-initialized",
      "at": "2026-09-07T03:46:14Z",
      "os": "engineering",
      "stage": "INTAKE"
    }
  ],
  "artifacts": {},
  "evidence": [],
  "assumptions": [],
  "decisions": [],
  "risks": [],
  "traceability": [],
  "gates": {},
  "learning": [],
  "routing_log": [],
  "runs": [],
  "work_items": {},
  "active_work_id": ""
}
